{
  "$schema": "https://json-schema.org/draft/2020-12/schema",
  "$id": "https://example.invalid/schemas/malware-behavior-report-v2.json",
  "title": "Inert Malware Behavior Report with ATT&CK Mappings",
  "type": "object",
  "additionalProperties": false,
  "required": ["schema_version", "artifact_included", "sample", "analysis", "observations", "attack_mappings"],
  "properties": {
    "schema_version": {"const": 2},
    "artifact_included": {"const": false},
    "sample": {
      "type": "object",
      "additionalProperties": false,
      "required": ["sha256", "provenance"],
      "properties": {
        "sha256": {"type": "string", "pattern": "^[0-9a-f]{64}$"},
        "provenance": {"enum": ["synthetic_fixture", "authorized_local_sample"]}
      }
    },
    "analysis": {
      "type": "object",
      "additionalProperties": false,
      "required": ["environment", "tools"],
      "properties": {
        "environment": {"enum": ["static_only", "isolated_lab"]},
        "tools": {"type": "array", "items": {"type": "string", "minLength": 1, "maxLength": 80}, "maxItems": 20}
      }
    },
    "observations": {
      "type": "array",
      "minItems": 1,
      "maxItems": 200,
      "items": {
        "type": "object",
        "additionalProperties": false,
        "required": ["id", "phase", "category", "description", "evidence", "confidence"],
        "properties": {
          "id": {"type": "string", "pattern": "^[a-z0-9][a-z0-9._-]{0,63}$"},
          "phase": {"enum": ["static", "dynamic"]},
          "category": {"enum": ["process", "file", "registry", "network", "anti_analysis", "other"]},
          "description": {"type": "string", "minLength": 1, "maxLength": 300},
          "evidence": {"type": "array", "minItems": 1, "maxItems": 20, "items": {"type": "string", "minLength": 1, "maxLength": 240}},
          "confidence": {"type": "number", "minimum": 0, "maximum": 1}
        }
      }
    },
    "attack_mappings": {
      "type": "array",
      "maxItems": 50,
      "items": {
        "type": "object",
        "additionalProperties": false,
        "required": ["technique_id", "technique_name", "observation_ids", "confidence", "rationale"],
        "properties": {
          "technique_id": {"type": "string", "pattern": "^T[0-9]{4}(\\.[0-9]{3})?$"},
          "technique_name": {"type": "string", "minLength": 1, "maxLength": 120},
          "observation_ids": {"type": "array", "minItems": 1, "maxItems": 20, "uniqueItems": true, "items": {"type": "string", "pattern": "^[a-z0-9][a-z0-9._-]{0,63}$"}},
          "confidence": {"type": "number", "minimum": 0, "maximum": 1},
          "rationale": {"type": "string", "minLength": 1, "maxLength": 300}
        }
      }
    }
  }
}
