{
  "schema_version": 2,
  "artifact_included": false,
  "sample": {
    "sha256": "a7f9665b5477ade38ef707df521d7948a8c27fd46b4def2b39d2ce77cafd0008",
    "provenance": "synthetic_fixture"
  },
  "analysis": {
    "environment": "static_only",
    "tools": [
      "synthetic-report-fixture"
    ]
  },
  "observations": [
    {
      "id": "static-suspicious-execution-api",
      "phase": "static",
      "category": "process",
      "description": "Synthetic source text contains a command-execution API reference.",
      "evidence": [
        "fixture line 12 contains the inert token std::system"
      ],
      "confidence": 0.4
    },
    {
      "id": "static-network-library",
      "phase": "static",
      "category": "network",
      "description": "Synthetic source text contains a network-library symbol reference.",
      "evidence": [
        "fixture line 4 contains the inert token curl_easy_perform"
      ],
      "confidence": 0.3
    }
  ],
  "attack_mappings": [
    {
      "technique_id": "T1059",
      "technique_name": "Command and Scripting Interpreter",
      "observation_ids": [
        "static-suspicious-execution-api"
      ],
      "confidence": 0.2,
      "rationale": "The static API reference is a weak clue only. It does not show that a command interpreter executed."
    }
  ]
}
